{
  "schema_version": 1,
  "scope": "static_source_audit",
  "production_usable": false,
  "observed_at": "2026-10-06T06:43:47.693814+00:00",
  "repositories": [
    {
      "id": "ioenv_cli",
      "repository": "https://github.com/ioai-tech/ioenv_cli.git",
      "checkout_ref": "main",
      "commit_sha": "ec1f8354095de91a234dc31a9213ee1a410b5cc9",
      "observed_at": "2026-10-06T06:43:47.515242+00:00",
      "reference_directory": "work/upstream/ioenv_cli",
      "source_ids": [
        "S01",
        "S02",
        "S03",
        "S04",
        "S05",
        "S06",
        "S07"
      ],
      "paths": [
        "LICENSE",
        "README.md",
        "bin/ioenv",
        "conf.d/mirrors.env",
        "env.d/isaaclab.env",
        "env.d/mujocosim.env",
        "env.d/onboard.env",
        "ioenv.sh"
      ],
      "file_hashes": {
        "LICENSE": "305ca1ea1ab1d7ef11521eb96aa70041a24ad246c48fe7f689427235dadeb8a0",
        "README.md": "dd7b80510b3665b1e8ebbf2f72ac63c53ba87da93b893aa5ef233c7daa6a1125",
        "bin/ioenv": "9e580d837e0ee68ca7cd6958502bbb89e4ac21cee88834b2e252d28bb05001c1",
        "conf.d/mirrors.env": "3c42e86de4f43d92ddf86d427a6a1d575947c461ac453a14a98d8028fe859e07",
        "env.d/isaaclab.env": "4ebfe1d92c4f5c76f5d853b3834854b14a475cf8d3559923b3b7be0ae8ca6ceb",
        "env.d/mujocosim.env": "fa48abda598d77e82ee9bb05d05e31224897fccab0e9bd62d581b7debea2a628",
        "env.d/onboard.env": "21a364590e933b9fc447f25d2dc68053b9c28a3ba33ec40b772f59366eeda308",
        "ioenv.sh": "796472954da8ed47e19ad0cf1ae2eafe84e8494ba7f43633286e0c840d1c37b5"
      },
      "license_path": "LICENSE",
      "license_identifier": "MIT",
      "retrieval_status": "retrieved",
      "blocked_reasons": {},
      "available_tags": [],
      "git_refs_query_status": "retrieved",
      "available_releases": [],
      "releases_query_status": "retrieved",
      "binary_metadata": [],
      "transitive_dependency_audit": "not_completed",
      "hardware_status": "not_implemented",
      "evidence_logs": [
        "work/evidence/task0-ioenv_cli-commands.jsonl",
        "work/evidence/task0-ioenv_cli-tree.txt",
        "work/evidence/task0-file-hashes.json",
        "work/evidence/task0-http-commands.jsonl",
        "work/evidence/task0-curl-commands.jsonl",
        "work/evidence/task0-ioenv_cli-releases.json"
      ]
    },
    {
      "id": "humanoid_controller",
      "repository": "https://github.com/ioai-tech/humanoid_controller.git",
      "checkout_ref": "main",
      "commit_sha": "2f94ff0ebd072e255d90bbbb2122d0f1a622a0b3",
      "observed_at": "2026-10-06T06:43:47.557126+00:00",
      "reference_directory": "work/upstream/humanoid_controller",
      "source_ids": [
        "S09",
        "S10",
        "S11"
      ],
      "paths": [
        "CMakeLists.txt",
        "LICENSE",
        "README.md",
        "include/humanoid_controller/tasks/motion_tracking/LICENCE",
        "launch/mujoco.launch.py",
        "launch/real.launch.py",
        "launch/wandb.launch.py",
        "package.xml"
      ],
      "file_hashes": {
        "CMakeLists.txt": "40c463d430f1f1a02ead78a65199dfd255d9a02d9f79e5c6f49a487588eee900",
        "LICENSE": "4ea1dc2a8225bb54a0842ca3f3c77a8e54d02211b5603c38f386ef53eb1327e0",
        "README.md": "27501f0b9f2d9a9e8fa6eaf543aeea4a092763fbe64bc681fc598be7c50539d3",
        "include/humanoid_controller/tasks/motion_tracking/LICENCE": "e77307080e79d146cd55e50396a1cd80ead0eabc2d474d880ec5e3fb30a4f2e2",
        "launch/mujoco.launch.py": "9f6b0ac3f342b055819e585195b7d1b8201e9b2d9f02e8e9f6e3c5a01237fbfc",
        "launch/real.launch.py": "2ffd9b28a027f1711f969bc5acd6f3dae72b1eef0680b672e7adcd27df8b35f3",
        "launch/wandb.launch.py": "6ee35895b5c3c6c43611da29d481e953a03004f01fd38ee946acf971aeb92720",
        "package.xml": "409b6639d6dd91bc787a01d8cab6ebbd53d0416ef32d732296b616f0c75f6edb"
      },
      "license_path": "LICENSE",
      "license_identifier": "MIT",
      "retrieval_status": "retrieved",
      "blocked_reasons": {},
      "available_tags": [],
      "git_refs_query_status": "retrieved",
      "available_releases": [],
      "releases_query_status": "retrieved",
      "binary_metadata": [],
      "transitive_dependency_audit": "not_completed",
      "hardware_status": "not_implemented",
      "evidence_logs": [
        "work/evidence/task0-humanoid_controller-commands.jsonl",
        "work/evidence/task0-humanoid_controller-tree.txt",
        "work/evidence/task0-file-hashes.json",
        "work/evidence/task0-http-commands.jsonl",
        "work/evidence/task0-curl-commands.jsonl",
        "work/evidence/task0-humanoid_controller-releases.json"
      ]
    },
    {
      "id": "robot_hardware_interface",
      "repository": "https://github.com/ioai-tech/robot_hardware_interface.git",
      "checkout_ref": "main",
      "commit_sha": "fbc18ed07a1926a9f8731b182931d17e1217dbd7",
      "observed_at": "2026-10-06T06:43:47.582036+00:00",
      "reference_directory": "work/upstream/robot_hardware_interface",
      "source_ids": [
        "S12"
      ],
      "paths": [
        "CMakeLists.txt",
        "LICENSE",
        "README.md",
        "include/robot_hardware_interface/agibot/x2.hpp",
        "package.xml",
        "robot_hardware_interface.xml",
        "src/agibot/x2.cpp"
      ],
      "file_hashes": {
        "CMakeLists.txt": "6bf26e5210ed89d2f6b003f9b21f17b581ca9735c8cf859fb0c7929af72cfaa9",
        "LICENSE": "305ca1ea1ab1d7ef11521eb96aa70041a24ad246c48fe7f689427235dadeb8a0",
        "README.md": "e76a5ac817d8fc7ca688d9542d250de4d38d58ec9e3a0da60f2f849d5d8591ea",
        "include/robot_hardware_interface/agibot/x2.hpp": "b27d5840046b81908e33c92ba0260bd255f158dcd450afd917c60f674e23864d",
        "package.xml": "eda3fa5da38b8e49565e977e2eb38ec3065d255607c4eee408057057291c23bf",
        "robot_hardware_interface.xml": "4bca2a79203338a9f04fe2d77c9bdad3b0d48feac3f28b390b26d045f8239439",
        "src/agibot/x2.cpp": "8b28ddf3610acbc65c4617b49ef00876dcb4af802bf4b961a7b20d3e08ebb900"
      },
      "license_path": "LICENSE",
      "license_identifier": "MIT",
      "retrieval_status": "retrieved",
      "blocked_reasons": {},
      "available_tags": [],
      "git_refs_query_status": "retrieved",
      "available_releases": [],
      "releases_query_status": "retrieved",
      "binary_metadata": [],
      "transitive_dependency_audit": "not_completed",
      "hardware_status": "not_implemented",
      "evidence_logs": [
        "work/evidence/task0-robot_hardware_interface-commands.jsonl",
        "work/evidence/task0-robot_hardware_interface-tree.txt",
        "work/evidence/task0-file-hashes.json",
        "work/evidence/task0-http-commands.jsonl",
        "work/evidence/task0-curl-commands.jsonl",
        "work/evidence/task0-robot_hardware_interface-releases.json"
      ]
    },
    {
      "id": "agibot_D1_Edu-Ultra",
      "repository": "https://github.com/AgibotTech/agibot_D1_Edu-Ultra.git",
      "checkout_ref": "main",
      "commit_sha": "b5fe0a86094507238944ad118721376a98615ac0",
      "observed_at": "2026-10-06T06:43:47.605528+00:00",
      "reference_directory": "work/upstream/agibot_D1_Edu-Ultra",
      "source_ids": [
        "S13",
        "S14",
        "S15",
        "S16",
        "S17",
        "S23"
      ],
      "paths": [
        "LICENSE",
        "README.md",
        "README_zh.md",
        "demo/zsl-1/cpp/CMakeLists.txt",
        "demo/zsl-1w/cpp/CMakeLists.txt",
        "docs/about.md",
        "docs/api.md",
        "docs/api_lowlevel.md",
        "docs/api_zsl-1.md",
        "docs/api_zsl-1w.md",
        "docs/architecture.md",
        "docs/changelog.md",
        "docs/deploy.md",
        "docs/faq.md",
        "docs/index.md",
        "docs/sdk_download.md",
        "docs/video.md",
        "include/zsl-1/highlevel.h",
        "include/zsl-1w/highlevel.h",
        "lib/zsl-1/aarch64/libmc_sdk_zsl_1_aarch64.so",
        "lib/zsl-1/aarch64/mc_sdk_zsl_1_py.cpython-310-aarch64-linux-gnu.so",
        "lib/zsl-1/x86_64/libmc_sdk_zsl_1_x86_64.so",
        "lib/zsl-1/x86_64/mc_sdk_zsl_1_py.cpython-310-x86_64-linux-gnu.so",
        "lib/zsl-1w/aarch64/libmc_sdk_zsl_1w_aarch64.so",
        "lib/zsl-1w/aarch64/mc_sdk_zsl_1w_py.cpython-310-aarch64-linux-gnu.so",
        "lib/zsl-1w/x86_64/libmc_sdk_zsl_1w_x86_64.so",
        "lib/zsl-1w/x86_64/mc_sdk_zsl_1w_py.cpython-310-x86_64-linux-gnu.so"
      ],
      "file_hashes": {
        "LICENSE": "c0cc52d6bdaf4f5d3d0b21d6a2c16629e77d6ca3d67646fd6b91dde99b734e3a",
        "README.md": "bdbb2cf06b56ba02e91ab946e7fd0532ca97b4301e069e6cddfddbeec1df99e3",
        "README_zh.md": "cf308c5598a4b133771290e60025d2f343752677b6848b8a724633dbeeaed9fe",
        "demo/zsl-1/cpp/CMakeLists.txt": "4658b135784be9bb7ff0670d5a883742862f73b1e7679bb1b167004e2c505a06",
        "demo/zsl-1w/cpp/CMakeLists.txt": "cfbdb488be4cc66f2c3e86342d8848ff93460da873b01e0044fcc7dff3e29fc9",
        "docs/about.md": "72f52d8e473e70c4f5308e23652ec9e4d03b8b3701f9c2f83b4bd1d70f4e5323",
        "docs/api.md": "340969d0528a7949abd6f18d2cd72a54ea7bad6ee710fe4a3e04f1cc42580688",
        "docs/api_lowlevel.md": "5f3cda786caf94418baae35c3d12ca6c64ae0f6317da9653342499610072e9d9",
        "docs/api_zsl-1.md": "a3c287d9b56ce3e8d4fe7249cb7739330add9dff88a3f3c21bfbcd940e142301",
        "docs/api_zsl-1w.md": "20a2a5fcda926b7047c9cb34d88e093fecdc888afc7416370fd4bfdbe454ea63",
        "docs/architecture.md": "6decdd00c6a7e9361d65d2c1f39e4d150a66c1995747a1f324888be3e5c9dd4d",
        "docs/changelog.md": "f94432b824b95c051e2d173bb979ff2a6370475840175a55186efe15c5efff43",
        "docs/deploy.md": "6bd72ea9f6159091f095a149703baf09066398261ced188dccdf931ff0bf0e63",
        "docs/faq.md": "109b0ec4ac218145ef27140eb037e56ed824d101d1ba6fa6651d52ef525fe689",
        "docs/index.md": "6cb16914d3fd075d04f2ef1f56221d37a30609ef727c0712f23692b03345f4be",
        "docs/sdk_download.md": "fc36c255e1fa611d149e1ef8a3014b46c3e7dcc9083a9ef5ee3715f18c8bca48",